{
  "$schema": "../../schema.json",
  "supplier": "Apple",
  "model": "iPad Air (M4)",
  "model_ids": [],
  "os": "ipados",
  "os_min": "18",
  "os_max": "current",
  "status": "current",
  "form_factor": "tablet",
  "tags": ["m4", "apple-pencil-pro", "usb-c", "wifi-6e"],
  "verified": false,
  "sources": [],
  "hardware": {
    "chip": "Apple M4",
    "cpu_cores": 10,
    "gpu_cores": 10,
    "neural_engine_cores": 16,
    "ram_gb": 8,
    "storage_gb": [128, 256, 512, 1024],
    "display": {
      "size_in": 11,
      "resolution": "2360x1640",
      "ppi": 264,
      "panel": "Liquid Retina LCD",
      "refresh_hz_min": 60,
      "refresh_hz_max": 60,
      "brightness_nits_typ": 500
    },
    "battery": {
      "wired_w": 20
    }
  },
  "cameras": {
    "rear": [
      { "type": "wide", "megapixels": 12, "aperture": "f/1.8" }
    ],
    "front": [
      { "type": "ultra-wide", "megapixels": 12, "aperture": "f/2.4", "fov_deg": 122, "notes": "landscape orientation, Center Stage" }
    ],
    "features": ["Smart HDR 4", "4K30 video"]
  },
  "connectivity": {
    "cellular": ["5G sub-6 (cellular models)", "LTE"],
    "wifi": "Wi-Fi 6E (802.11ax)",
    "bluetooth": "5.3",
    "nfc": false,
    "uwb": false,
    "port": "USB-C",
    "usb_speed_gbps": 10,
    "gnss": ["GPS", "GLONASS", "Galileo", "QZSS", "BeiDou", "NavIC"]
  },
  "biometrics": ["touch-id"],
  "sensors": ["accelerometer", "gyroscope", "ambient-light", "barometer"],
  "durability": {
    "frame": "Aluminum"
  },
  "sim": {
    "physical": false,
    "esim": true,
    "dual_esim": true,
    "notes": "Cellular models only; Wi-Fi only models have no SIM."
  },
  "accessories": ["Apple Pencil Pro", "Apple Pencil (USB-C)", "Magic Keyboard for iPad Air", "Smart Folio"],
  "notes": "UNVERIFIED: specs inferred from iPad Air (M2, May 2024) baseline with chip swapped to M4. Confirm release date, RAM tiers, and any display/camera changes against the official Apple spec sheet before relying on this card. A 13\" variant likely also exists with proportionally higher resolution."
}
